"Status","Start Time","Stop Time","Duration in ms","Parent Suite","Suite","Sub Suite","Test Class","Test Method","Name","Description"
"passed","Fri Aug 28 05:50:15 GMT 2020","Fri Aug 28 05:50:16 GMT 2020","1004","","Labels","","Add label to existing issue for authorized user","","Add label to existing issue for authorized user",""
"passed","Fri Aug 28 05:50:14 GMT 2020","Fri Aug 28 05:50:14 GMT 2020","2","","Labels","","Create new label for authorized user","","Create new label for authorized user",""
"passed","Fri Aug 28 05:50:16 GMT 2020","Fri Aug 28 05:50:16 GMT 2020","2","","Milestones","","Create new milestone for authorized user","","Create new milestone for authorized user",""
"passed","Fri Aug 28 05:50:14 GMT 2020","Fri Aug 28 05:50:14 GMT 2020","23","","Labels","","Delete existing label via api","","Delete existing label via api",""
"passed","Fri Aug 28 05:50:16 GMT 2020","Fri Aug 28 05:50:16 GMT 2020","11","","Milestones","","Close existing milestone for authorized user","","Close existing milestone for authorized user",""
"passed","Fri Aug 28 05:50:14 GMT 2020","Fri Aug 28 05:50:14 GMT 2020","24","","Labels","","Create new label via api","","Create new label via api",""
"broken","Fri Aug 28 05:50:16 GMT 2020","Fri Aug 28 05:50:16 GMT 2020","13","","Labels","","Delete existing label for authorized user","","Delete existing label for authorized user",""
